{
  "$schema": "https://json-schema.org/draft/2020-12/schema",
  "$id": "https://bsv-blockchain.github.io/dpp/profiles/schemas/exchange-profile.schema.json",
  "title": "DPP exchange profile manifest, version 1",
  "description": "One credential representation beside the native record (spec/exchange.md section 2): its format, data model, pinned artefacts, proof suites, native evidence extension, anchoring rule, mappings and explicit unsupported items. An artefact without a digest is recorded as not retrieved and supports no claim.",
  "type": "object",
  "additionalProperties": false,
  "required": ["manifestVersion", "id", "version", "profile", "kind", "status", "title", "representation", "mediaType", "dataModel", "artefacts", "proofSuites", "anchoring", "nativeEvidenceExtension", "mappings", "unsupported", "sourceRefs"],
  "properties": {
    "manifestVersion": { "const": "1" },
    "id": { "type": "string", "pattern": "^[a-z][a-z0-9.-]*$" },
    "version": { "type": "string", "pattern": "^[0-9][0-9a-z.-]*$" },
    "profile": { "type": "string", "pattern": "^[a-z][a-z0-9.-]*@[0-9][0-9a-z.-]*$" },
    "kind": { "const": "exchange" },
    "status": { "enum": ["proposed", "current", "superseded"] },
    "title": { "type": "string", "minLength": 1 },
    "description": { "type": "string" },
    "representation": { "type": "string", "minLength": 1, "description": "The representation identifier a reader dispatches on." },
    "mediaType": { "type": "string", "minLength": 1 },
    "dataModel": { "type": "string", "minLength": 1 },
    "specification": { "type": "string", "description": "Where in spec/ the representation's byte contract is defined." },
    "artefacts": {
      "type": "array",
      "items": {
        "type": "object",
        "additionalProperties": false,
        "required": ["id", "kind", "uri", "version", "retrieval"],
        "properties": {
          "id": { "type": "string" },
          "kind": { "enum": ["json-schema", "jsonld-context", "vocabulary", "specification"] },
          "uri": { "type": "string" },
          "version": { "type": "string" },
          "digest": { "type": "string", "pattern": "^[0-9a-f]{64}$" },
          "retrieval": { "enum": ["pinned", "not-retrieved", "unavailable", "owned"], "description": "pinned: digest computed over retrieved bytes. not-retrieved: documented location, no bytes fetched yet. unavailable: the upstream location does not serve it. owned: published by this repository." },
          "licence": { "type": "string" },
          "notes": { "type": "string" }
        },
        "allOf": [
          { "if": { "properties": { "retrieval": { "const": "pinned" } } }, "then": { "properties": { "digest": { "type": "string" } }, "required": ["digest"] } }
        ]
      }
    },
    "proofSuites": {
      "type": "array",
      "minItems": 1,
      "items": {
        "type": "object",
        "additionalProperties": false,
        "required": ["id", "support"],
        "properties": {
          "id": { "type": "string", "description": "For example ES256K, ES256, Ed25519Signature2020, bbs-2023, ecdsa-jcs-2019." },
          "support": { "enum": ["issue-and-verify", "verify-only", "optional-dedicated-key", "not-supported"] },
          "keyRule": { "type": "string", "description": "How the signing key relates to the issuer and to the BSV actor, and what it must never be derived from." },
          "consumerMustConfirm": { "type": "boolean" },
          "notes": { "type": "string" }
        }
      }
    },
    "anchoring": {
      "type": "object",
      "additionalProperties": false,
      "required": ["format", "bytesCommitted", "attestationIdRule", "subjectRule"],
      "properties": {
        "format": { "const": "bsv-attestation-anchor-v1" },
        "bytesCommitted": { "type": "string" },
        "attestationIdRule": { "type": "string" },
        "subjectRule": { "type": "string" },
        "attestationType": { "type": "string" }
      }
    },
    "nativeEvidenceExtension": {
      "type": "object",
      "additionalProperties": false,
      "required": ["schema", "version", "carried"],
      "properties": {
        "schema": { "type": "string" },
        "version": { "type": "string" },
        "carried": { "enum": ["required", "optional", "not-applicable"] },
        "notes": { "type": "string" }
      }
    },
    "mappings": {
      "type": "array",
      "items": {
        "type": "object",
        "additionalProperties": false,
        "required": ["nativeOperation", "externalEvent", "requires", "withoutEvidence"],
        "properties": {
          "nativeOperation": { "enum": ["ACTIVATE", "SOLD", "RESOLD", "REPAIRED", "RECYCLED", "EDIT", "TRANSFER"] },
          "externalEvent": { "type": "string" },
          "requires": { "type": "string" },
          "withoutEvidence": { "enum": ["insufficient-data", "unsupported", "transformed"] }
        }
      }
    },
    "storage": {
      "type": "object",
      "additionalProperties": false,
      "description": "The four artefacts of spec/exchange.md section 3, named so a consumer implements them separately.",
      "required": ["nativeClaim", "originalSecured", "decoded", "projection"],
      "properties": {
        "nativeClaim": { "type": "string" },
        "originalSecured": { "type": "string" },
        "decoded": { "type": "string" },
        "projection": { "type": "string" }
      }
    },
    "unsupported": {
      "type": "array",
      "items": {
        "type": "object",
        "additionalProperties": false,
        "required": ["id", "reason"],
        "properties": { "id": { "type": "string" }, "reason": { "type": "string" } }
      }
    },
    "sourceRefs": {
      "type": "array",
      "items": {
        "type": "object",
        "additionalProperties": false,
        "required": ["id", "name", "use"],
        "properties": {
          "id": { "type": "string" },
          "name": { "type": "string" },
          "reference": { "type": "string" },
          "version": { "type": "string" },
          "attribution": { "type": "string" },
          "use": { "type": "string" }
        }
      }
    }
  }
}
